ffff880206b7c180 981485021 S Bo:3:005:5 -115 10 = 65000000 00006f00 0000
ffff880206b7c180 981485107 C Bo:3:005:5 0 10 >
ffff880211bdccc0 981485242 S Bi:3:005:4 -115 10 <
ffff880211bdccc0 981485477 C Bi:3:005:4 0 10 = 81000000 00006f01 0001
ffff880211bdccc0 981485511 S Bo:3:005:5 -115 10 = 62000000 00007001 0000
ffff880211bdccc0 981485600 C Bo:3:005:5 0 10 >
ffff880211bdccc0 981485625 S Bi:3:005:4 -115 43 <
ffff880211bdccc0 981517533 C Bi:3:005:4 0 32 = 80160000 00007000 00003bdc 18ff8191 fe1fc380 73c82113 66010b03 52000538
ffff88021558bcc0 981517587 S Bo:3:005:5 -115 17 = 61070000 00007101 00001810 ff4d00fe 00
ffff88021558bcc0 981517759 C Bo:3:005:5 0 17 >
ffff88021558b540 981517797 S Bi:3:005:4 -115 17 <
ffff88021558b540 981526785 C Bi:3:005:4 0 17 = 82070000 00007100 00011810 ff4d00fe 00
ffff8800a215ba80 981529045 C Ii:3:005:3 -2:16 0
ffff8801a5a3c480 981531891 S Bo:3:005:5 -115 28 = 6f120000 00007200 000000a4 04000ca0 00000164 4c415345 52000100
ffff8801a5a3c480 981532018 C Bo:3:005:5 0 28 >
ffff8801a5a3c480 981532043 S Bi:3:005:4 -115 65556 <
ffff8801a5a3c480 981574963 C Bi:3:005:4 0 12 = 80020000 00007200 00009000
ffff880206b7c9c0 981586476 S Bo:3:005:5 -115 21 = 6f0b0000 00007300 000080a4 0800063f 003000ee ee
ffff880206b7c9c0 981586692 C Bo:3:005:5 0 21 >
ffff880206b7c9c0 981586748 S Bi:3:005:4 -115 65556 <
ffff880206b7c9c0 981596235 C Bi:3:005:4 0 12 = 80020000 00007300 00009000
ffff880206b7c9c0 981596451 S Bo:3:005:5 -115 15 = 6f050000 00007400 000000b0 000000
ffff880206b7c9c0 981596576 C Bo:3:005:5 0 15 >
ffff880206b7c9c0 981596627 S Bi:3:005:4 -115 65556 <
ffff880206b7c9c0 981619872 C Bi:3:005:4 0 185 = 80af0000 00007400 000002c0 0700000a 000f0001 02c20a00 04100000 00000000
ffff880206b7c9c0 981620096 S Bo:3:005:5 -115 21 = 6f0b0000 00007500 000080a4 0800063f 003000c0 00
ffff880206b7c9c0 981620205 C Bo:3:005:5 0 21 >
ffff880206b7c9c0 981620256 S Bi:3:005:4 -115 65556 <
ffff880206b7c9c0 981629125 C Bi:3:005:4 0 12 = 80020000 00007500 00009000
ffff880206b7c9c0 981629351 S Bo:3:005:5 -115 15 = 6f050000 00007600 000000b0 000000
ffff880206b7c9c0 981629466 C Bo:3:005:5 0 15 >
ffff880206b7c9c0 981629517 S Bi:3:005:4 -115 65556 <
ffff880206b7c9c0 981651762 C Bi:3:005:4 0 173 = 80a30000 00007600 00004944 50726f74 65637420 20202020 20202020 20202020
ffff880206b7c9c0 981651980 S Bo:3:005:5 -115 21 = 6f0b0000 00007700 000080a4 0800063f 00300030 04
ffff880206b7c9c0 981652090 C Bo:3:005:5 0 21 >
ffff880206b7c9c0 981652141 S Bi:3:005:4 -115 65556 <
ffff880206b7c9c0 981663238 C Bi:3:005:4 0 12 = 80020000 00007700 00006a82
ffff880206b7c9c0 981663494 S Bo:3:005:5 -115 23 = 6f0d0000 00007800 000080a4 0800083f 00300030 01d07e
ffff880206b7c9c0 981663573 C Bo:3:005:5 0 23 >
ffff880206b7c9c0 981663625 S Bi:3:005:4 -115 65556 <
ffff880206b7c9c0 981676534 C Bi:3:005:4 0 12 = 80020000 00007800 00006a82
ffff880206b7c9c0 981676952 S Bo:3:005:5 -115 23 = 6f0d0000 00007900 000080a4 0800083f 00300030 034000
ffff880206b7c9c0 981677108 C Bo:3:005:5 0 23 >
ffff880206b7c9c0 981677197 S Bi:3:005:4 -115 65556 <
ffff880206b7c9c0 981687789 C Bi:3:005:4 0 12 = 80020000 00007900 00009000
ffff8800bd503b40 981688154 S Bo:3:005:5 -115 15 = 6f050000 00007a00 000000b0 000264
ffff8800bd503b40 981688372 C Bo:3:005:5 0 15 >
ffff8800bd503b40 981688445 S Bi:3:005:4 -115 65556 <
ffff8800bd503b40 981697294 C Bi:3:005:4 0 28 = 80120000 00007a00 00004154 48454e41 534ec0ad aa78fc88 420d9000
ffff8801a5a3c480 981713000 S Bo:3:005:5 -115 20 = 6f0a0000 00007b00 000080a4 080c043f 00002000
ffff8801a5a3c480 981713108 C Bo:3:005:5 0 20 >
ffff8801a5a3c480 981713191 S Bi:3:005:4 -115 65556 <
ffff8801a5a3c480 981728590 C Bi:3:005:4 0 61 = 80330000 00007b00 0000622f 87010883 02002080 0200108a 0104860e 00ffc030
ffff8801a5a3c480 981735741 S Bo:3:005:5 -115 19 = 6f090000 00007c00 000080a4 0800043f 000020
ffff8801a5a3c480 981735908 C Bo:3:005:5 0 19 >
ffff8801a5a3c480 981735983 S Bi:3:005:4 -115 65556 <
ffff8801a5a3c480 981744087 C Bi:3:005:4 0 12 = 80020000 00007c00 00009000
ffff8801a5a3c480 981744357 S Bo:3:005:5 -115 15 = 6f050000 00007d00 00000084 000008
ffff8801a5a3c480 981744515 C Bo:3:005:5 0 15 >
ffff8801a5a3c480 981744587 S Bi:3:005:4 -115 65556 <
ffff8801a5a3c480 981752971 C Bi:3:005:4 0 20 = 800a0000 00007d00 00002c90 6c35a118 a6249000
ffff8801a5a3c480 981753662 S Bo:3:005:5 -115 31 = 6f150000 00007e00 00008020 00001075 7b670300 8b78e552 76c6a6f6 13c130
ffff8801a5a3c480 981753750 C Bo:3:005:5 0 31 >
ffff8800d7eaa240 981753807 S Bi:3:005:4 -115 65556 <
ffff8800d7eaa240 981777727 C Bi:3:005:4 0 12 = 80020000 00007e00 00009000
ffff88005ad08f00 981778114 S Bo:3:005:5 -115 23 = 6f0d0000 00007f00 000080a4 0800083f 00300030 034001
ffff88005ad08f00 981778299 C Bo:3:005:5 0 23 >
ffff88005ad08f00 981778370 S Bi:3:005:4 -115 65556 <
ffff88005ad08f00 981788365 C Bi:3:005:4 0 12 = 80020000 00007f00 00009000
ffff88005ad08f00 981788734 S Bo:3:005:5 -115 15 = 6f050000 00008000 000000b0 000301
ffff88005ad08f00 981788927 C Bo:3:005:5 0 15 >
ffff88005ad08f00 981789000 S Bi:3:005:4 -115 65556 <
ffff88005ad08f00 981796490 C Bi:3:005:4 0 13 = 80030000 00008000 00000490 00
ffff88005ad08f00 981796891 S Bo:3:005:5 -115 23 = 6f0d0000 00008100 000080a4 0800083f 00300030 02d07e
ffff88005ad08f00 981797032 C Bo:3:005:5 0 23 >
ffff88005ad08f00 981797093 S Bi:3:005:4 -115 65556 <
ffff88005ad08f00 981810627 C Bi:3:005:4 0 12 = 80020000 00008100 00006a82
ffff88005ad08f00 981811092 S Bo:3:005:5 -115 23 = 6f0d0000 00008200 000080a4 0800083f 00300030 01d07e
ffff88005ad08f00 981811312 C Bo:3:005:5 0 23 >
ffff88005ad08f00 981811385 S Bi:3:005:4 -115 65556 <
ffff88005ad08f00 981824256 C Bi:3:005:4 0 12 = 80020000 00008200 00006a82
ffff88005ad08f00 981824701 S Bo:3:005:5 -115 21 = 6f0b0000 00008300 000080a4 0800063f 003000ee ef
ffff88005ad08f00 981824790 C Bo:3:005:5 0 21 >
ffff8801a5a3c780 981824888 S Bi:3:005:4 -115 65556 <
ffff8801a5a3c780 981833634 C Bi:3:005:4 0 12 = 80020000 00008300 00009000
ffff8801a5a3c780 981833934 S Bo:3:005:5 -115 15 = 6f050000 00008400 000000b0 000000
ffff8801a5a3c780 981834045 C Bo:3:005:5 0 15 >
ffff8801a5a3c780 981834136 S Bi:3:005:4 -115 65556 <
ffff8801a5a3c780 981843014 C Bi:3:005:4 0 27 = 80110000 00008400 000002c4 010002c7 08323031 36313030 359000
ffff8801a5a3c780 981843332 S Bo:3:005:5 -115 19 = 6f090000 00008500 00008028 00000400 000020
ffff8801a5a3c780 981843422 C Bo:3:005:5 0 19 >
ffff8801a5a3c780 981843555 S Bi:3:005:4 -115 65556 <
ffff8801a5a3c780 981851144 C Bi:3:005:4 0 12 = 80020000 00008500 00009000
ffff8801a5a3c780 981929263 S Bo:3:005:5 -115 10 = 65000000 00008600 0000
ffff8801a5a3c780 981929351 C Bo:3:005:5 0 10 >
ffff8801a5a3c780 981929474 S Bi:3:005:4 -115 10 <
ffff8801a5a3c780 981929750 C Bi:3:005:4 0 10 = 81000000 00008600 0000
ffff8801a5a3c780 981929979 S Ii:3:005:3 -115:16 8 <
ffff8801a5a3c780 982705363 C Ii:3:005:3 -2:16 0
ffff880170547000 983105548 S Bo:3:005:5 -115 10 = 65000000 00008700 0000
ffff880170547000 983105680 C Bo:3:005:5 0 10 >
ffff880170547000 983105704 S Bi:3:005:4 -115 10 <
ffff880170547000 983105942 C Bi:3:005:4 0 10 = 81000000 00008700 0000